[
  {"schema_version":"1.0.0","sample_id":"000001","acquisition_session_id":"session-A","capture_id":"capture-A","within_capture_index":0,"timestamp_utc":"2026-01-01T00:00:00Z","timestamp_source":"hardware_clock","clock_reset_id":"reset-A","receiver_id":"receiver-01","site_id":"site-01","center_frequency_hz":100000000,"lower_frequency_hz":99000000,"upper_frequency_hz":101000000,"sample_rate_hz":2400000,"source_file_id":"550e8400-e29b-41d4-a716-446655440000.bin","source_record_index":0},
  {"schema_version":"1.0.0","sample_id":"000002","acquisition_session_id":"session-A","capture_id":"capture-A","within_capture_index":1,"timestamp_utc":"2026-01-01T00:00:01Z","timestamp_source":"hardware_clock","clock_reset_id":"reset-A","receiver_id":"receiver-02","site_id":"site-01","center_frequency_hz":100000000,"lower_frequency_hz":99000000,"upper_frequency_hz":101000000,"sample_rate_hz":2400000,"source_file_id":"550e8400-e29b-41d4-a716-446655440000.bin","source_record_index":1},
  {"schema_version":"1.0.0","sample_id":"000003","acquisition_session_id":"session-A","capture_id":"capture-A","within_capture_index":2,"timestamp_utc":"2026-01-01T00:00:02Z","timestamp_source":"hardware_clock","clock_reset_id":"reset-A","receiver_id":"receiver-01","site_id":"site-01","center_frequency_hz":102000000,"lower_frequency_hz":101000000,"upper_frequency_hz":103000000,"sample_rate_hz":2400000,"source_file_id":"550e8400-e29b-41d4-a716-446655440000.bin","source_record_index":2},
  {"schema_version":"1.0.0","sample_id":"000004","acquisition_session_id":"session-B","capture_id":"capture-B","within_capture_index":0,"timestamp_utc":"2026-01-02T00:00:00Z","timestamp_source":"hardware_clock","clock_reset_id":"reset-B","receiver_id":"receiver-01","site_id":"site-02","center_frequency_hz":100000000,"lower_frequency_hz":99000000,"upper_frequency_hz":101000000,"sample_rate_hz":2400000,"source_file_id":"550e8400-e29b-41d4-a716-446655440001.bin","source_record_index":0},
  {"schema_version":"1.0.0","sample_id":"000005","acquisition_session_id":"session-B","capture_id":"capture-B","within_capture_index":1,"timestamp_utc":"2026-01-02T00:00:01Z","timestamp_source":"hardware_clock","clock_reset_id":"reset-B","receiver_id":"receiver-02","site_id":"site-02","center_frequency_hz":100000000,"lower_frequency_hz":99000000,"upper_frequency_hz":101000000,"sample_rate_hz":2400000,"source_file_id":"550e8400-e29b-41d4-a716-446655440001.bin","source_record_index":1},
  {"schema_version":"1.0.0","sample_id":"000006","acquisition_session_id":"session-B","capture_id":"capture-B","within_capture_index":2,"timestamp_utc":"2026-01-02T00:00:02Z","timestamp_source":"hardware_clock","clock_reset_id":"reset-B","receiver_id":"receiver-01","site_id":"site-02","center_frequency_hz":102000000,"lower_frequency_hz":101000000,"upper_frequency_hz":103000000,"sample_rate_hz":2400000,"source_file_id":"550e8400-e29b-41d4-a716-446655440001.bin","source_record_index":2}
]
